title,description,content,publishedAt,url
Tokenized Assets Can Redefine Portfolio Management,"By representing real-world assets as digital tokens on a blockchain, we can begin to generate the kind of daily, market-derived data that has traditionally been reserved for a narrow set of assets, says EY’s Paul Brody.","For decades, your investment portfolio has revolved around a key academic idea that hasnt held up very well: efficient markets. Theres a direct line from the efficient markets theory of Eugene Fama i… [+6301 chars]",2025-02-28T00:17:09Z,https://www.coindesk.com/opinion/2025/02/27/how-tokenized-assets-could-redefine-portfolio-management
"'I've lost 4,500 sheep to thieves on Dartmoor'","A farmer has described Dartmoor as the ""Wild West"" amid ongoing sheep thefts.","Charlotte CoxBBC South West Investigations
Farmer Colin Abel says he knows of farmers who are thinking of quitting or bringing their sheep off the moors 
""It's beginning to feel like the Wild West … [+7151 chars]",2025-02-28T00:00:48Z,https://www.bbc.com/news/articles/cly44r4pvd5o
The Shattered Mirror of Globalisation: Unveiling the Consequences for the Electricity Industry,"2. The Future of Electricity and Industry The global energy sector is at a crossroads, with two competing pathways: Continuation of Fossil Fuels Many governments prioritize short-term energy security by extending the life of oil, gas, and coal, particularly i…","Many brand todays world a two-legged rat! for the brazen deception it embodies...
Workart fully right of Germán &amp; Co
""As President, I will set a national goal of ensuring that America has the N… [+164202 chars]",2025-02-27T23:33:44Z,https://energycentral.com/c/cp/shattered-mirror-globalisation-unveiling-consequences-electricity-industry
"‘Greed and Stupidity’ Are Killing Crypto Games, Says ‘Mystery Society’ CEO","Ethereum game The Mystery Society is suspending development, and the studio CEO isn’t mincing words about the state of the industry.","The Mystery Society, a Web3 game that pairs the casual-friendly gameplay of Among Us with a murder mystery vibe, has suspended development after developer Great Big Beautiful Tomorrow said it struggl… [+5776 chars]",2025-02-27T23:13:30Z,https://decrypt.co/308095/greed-stupidity-killing-crypto-games-mystery-society
CCP Contact Probes targets AI chip supply chain with advanced packaging solutions,"Benefiting from the booming demand for testing related to artificial intelligence (AI), CCP Contact Probes, a probe development and manufacturing company, has optimized its product structure and is making strides in the semiconductor and electric vehicle (EV)…","Save my User ID and Password
Some subscribers prefer to save their log-in information so they do not have to enter their User ID and Password each time they visit the site. To activate this function… [+307 chars]",2025-02-27T23:06:45Z,https://www.digitimes.com/news/a20250226PD211/testing-packaging-demand-supply-chain-development.html
Digital As Usual: Cyber Security 2025,"Human risk, supply chain risk and quantifying cyber risk.","Cyber security is now a business imperative, with organisations facing growing threats across three key areas: human behaviour, financial risk, and supply chain vulnerabilities. The Digital As Usual:… [+2312 chars]",2025-02-27T23:00:00Z,https://www.itnews.com.au/digital-as-usual-cyber-security-2025
"Consensus EasyA Hackathon Winners: AI Agents, Gaming, Trading, Payments, NFT Platforms",Hackathon for Consensus Hong Kong brought out some of the most innovative the early stage projects that could drive the Web3 world forward.,"Every successful crypto conference needs a Hackathon to showcase the ideas and projects that will usher in the next wave of Web3 ideas. Consensus Hong Kongorganized by EasyA, the start-up for develop… [+4735 chars]",2025-02-27T21:48:07Z,https://www.coindesk.com/consensus-hong-kong-2025-coverage/2025/02/27/consensus-hackathon-winners-ai-agents-gaming-trading-payments-and-nfts
OpenAI Launches GPT-4.5 But Limits It to Priciest Tiers After Running Out of GPUs,"The unexpected shortage 'isn't how we want to operate,' says CEO Sam Altman, but OpenAI presses ahead with the launch of a model that runs on 'vibes' and 'creative intelligence.'
OpenAI unveiled a new AI model today, GPT-4.5, but the launch did not go as plan…","OpenAI unveiled a new AI model today, GPT-4.5, but the launch did not go as planned.
The company ran out of GPUs, or computing power, ahead of the reveal, according to CEO Sam Altman. So OpenAI is l… [+3374 chars]",2025-02-27T21:34:24Z,https://uk.pcmag.com/ai/156882/openai-launches-gpt-45-but-limits-it-to-priciest-tiers-after-running-out-of-gpus
OpenAI Launches GPT-4.5 But Limits It to Priciest Tiers After Running Out of GPUs,"The unexpected shortage 'isn't how we want to operate,' says CEO Sam Altman, but OpenAI presses ahead with the launch of a model that runs on 'vibes' and 'creative intelligence.'
OpenAI unveiled a new AI model today, GPT-4.5, but the launch did not go as plan…","OpenAI unveiled a new AI model today, GPT-4.5, but the launch did not go as planned.
The company ran out of GPUs, or computing power, ahead of the reveal, according to CEO Sam Altman. So OpenAI is l… [+3374 chars]",2025-02-27T21:34:24Z,https://me.pcmag.com/en/ai/28622/openai-launches-gpt-45-but-limits-it-to-priciest-tiers-after-running-out-of-gpus
OpenAI Releases Preview of GPT-4.5,"On the heels of Anthropic rolling out Claude 3.7 Sonnet, OpenAI has announced a research preview of GPT-4.5, which is available to Pro users and developers.","On the heels of Anthropic rolling out Claude 3.7 Sonnet, OpenAI has announced a research preview of GPT-4.5, which is available to Pro users and developers.
According to OpenAI, GPT-4.5 is its “larg… [+3990 chars]",2025-02-27T21:32:10Z,https://www.webpronews.com/openai-releases-preview-of-gpt-4-5/
HP tops revenue estimates on PC market recovery; shares dip on weak profit view,"HP Inc beat first-quarter revenue estimates on Thursday, driven by strength in its personal systems segment and growing demand for artificial intelligence...","By Juby Babu
(Reuters) - HP Inc beat first-quarter revenue estimates on Thursday, driven by strength in its personal systems segment and growing demand for artificial intelligence-capable systems.
… [+1823 chars]",2025-02-27T21:19:57Z,https://finance.yahoo.com/news/hp-beats-quarterly-revenue-estimates-211957617.html
OpenAI finally unveils GPT-4.5. Here's what it can do,OpenAI says its latest model is more conversational and even hallucinates less. Here's how to access it.,"OpenAI
Earlier this month, OpenAI CEO Sam Altman shared a roadmap for its upcoming models, GPT-4.5 and GPT-5. In the X post, Altman shared that GPT-4.5, codenamed Orion internally, would be its last… [+5622 chars]",2025-02-27T21:11:00Z,https://www.zdnet.com/article/openai-finally-unveils-gpt-4-5-heres-what-it-can-do/
News 2/28/25,Top News A White House executive order requires hospitals to ...,"Top News
A White House executive order requires hospitals to publish their actual prices for 300 shoppable services online. A similar order that was issued by the Trump administration in 2019 has be… [+9932 chars]",2025-02-27T21:00:37Z,https://histalk2.com/2025/02/27/news-2-28-25/
OpenAI launches GPT-4.5 AI model with deeper knowledge and emotions,"OpenAI says GPT-4.5 is smarter and offers a broader bank of knowledge, higher accuracy, lower hallucination, and access to the latest information on the web.","OpenAI has just introduced its latest AI model, dubbed GPT-4.5, which the company claims is its largest and best model yet. This is not a reasoning model, a faculty which is limited to the O-series m… [+2576 chars]",2025-02-27T20:59:51Z,https://www.digitaltrends.com/computing/openai-gpt-4-5-ai-model-release-features/
"OpenAI launching GPT-4.5, its next general-purpose large language model",Last month CNBC reported that OpenAI was in discussions on a $40 billion funding round at a $340 billion valuation.,"OpenAI on Thursday announced the research preview of GPT-4.5, a general-purpose large language model. It will initially be open to software developers and people with ChatGPT Pro subscriptions.
The … [+2633 chars]",2025-02-27T20:44:36Z,https://www.cnbc.com/2025/02/27/openai-launching-gpt-4point5-general-purpose-large-language-model.html
"Rumor Replay: Foldable iPhone breakthrough, AirTag 2 release date, more","This is Rumor Replay, a weekly column at 9to5Mac offering a quick rundown of the most recent Apple product rumors, with analysis and commentary. Today: Apple’s foldable iPhone breakthrough, the AirTag 2 release window narrows, iPhone 17 Pro and 17e reports, a…","This is Rumor Replay, a weekly column at 9to5Mac offering a quick rundown of the most recent Apple product rumors, with analysis and commentary. Today: Apples foldable iPhone breakthrough, the AirTag… [+3971 chars]",2025-02-27T20:38:20Z,https://9to5mac.com/2025/02/27/rumor-replay-foldable-iphone-breakthrough-airtag-2-date-and-more/
"Nvidia gaming GPUs an afterthought as AI generates mountains of cash — RTX 50-series shortages mentioned, not explained","Nvidia just hit a record year in revenue, with data center sales bringing in most of the money. However, it seems that the gaming segment is being ignored in favor of its AI business.","Nvidia announced its fourth-quarter earnings last night, hitting a record full-year revenue of $130.5 billion — a 114% year-over-year increase owing to the high demand for its AI chips. But despite i… [+3177 chars]",2025-02-27T20:23:25Z,https://www.tomshardware.com/tech-industry/big-tech/nvidia-gaming-gpus-an-afterthought-as-ai-generates-mountains-of-cash-rtx-50-series-shortages-mentioned-not-explained
Chipotle Employs AI to Speed Up Recruiting Ahead of 'Burrito Season',The fast-casual restaurant chain developed an AI recruiting agent to help prepare for its busiest time of the year.,"The fast-casual restaurant chain developed an AI recruiting agent to help prepare for its busiest time of the year.
This story appeared on newsweek.com, 2025-02-27 19:59:00.",2025-02-27T20:09:15Z,https://biztoc.com/x/6d9861e0ccdfaac0
Tencent releases new AI model it says is faster than DeepSeek-R1,"Chinese technology giant Tencent Holdings Ltd. today released a new artificial intelligence model named Hunyuan Turbo S, designed as a “fast-thinking model,” a rival to so-called “slow-thinking” models such as DeepSeek-R1. The company explained the model is c…","Chinese technology giant Tencent Holdings Ltd. today released a new artificial intelligence model named Hunyuan Turbo S, designed as a fast-thinking model, a rival to so-called slow-thinking models s… [+2935 chars]",2025-02-27T20:00:37Z,https://siliconangle.com/2025/02/27/tencent-releases-new-ai-model-says-faster-deepseek-r1/
OpenAI Launches GPT-4.5 for ChatGPT—It’s Huge and Compute-Intensive,"Internally called Orion, GPT-4.5 is OpenAI’s largest model to date, and it’s only available through the company’s $200 monthly ChatGPT subscription.","GPT-4.5 is here, and OpenAIs newest generative AI model is bigger and more compute-intensive than everits supposedly also better at understanding what ChatGPT users mean with their prompts. Users who… [+3125 chars]",2025-02-27T20:00:00Z,https://www.wired.com/story/openai-gpt-45/
This Week in B2B Was About Unlocking Trapped Payments Data,"The B2B payments industry is on a compelling growth trajectory, and sector stakeholders can’t let paper processes jam the runway as B2B innovation takes off. A digital revolution is continually unfolding and advancing, transforming how businesses transact, ma…","The B2B payments industry is on a compelling growth trajectory, and sector stakeholders cant let paper processes jam the runway as B2B innovation takes off. A digital revolution is continually unfold… [+5329 chars]",2025-02-27T19:59:17Z,https://www.pymnts.com/news/b2b-payments/2025/this-week-in-b2b-was-about-unlocking-trapped-payments-data/
Chipotle Employs AI to Speed Up Recruiting Ahead of 'Burrito Season',The fast-casual restaurant chain developed an AI recruiting agent to help prepare for its busiest time of the year.,"Chipotle and its over 3,700 restaurants have received a boost in their talent pipeline just in time for their busy season, which the company says is from March to May. The boost came from the develop… [+2488 chars]",2025-02-27T19:59:00Z,https://www.newsweek.com/chipotle-artificial-intelligence-ai-recruiting-agent-ava-cado-2037322
Why The AI Industry Is Largely Unmoved By Trump’s Tariff Threats,"While Trump's tariff plans are causing widespread market jitters, many AI companies aren't shifting their longterm plans.","As President Trump has announced varying tariffs over the last month, tech stock prices have dipped, with investors fearing broad impacts on different parts of the tech sector. Shares of NVIDIA, Taiw… [+7079 chars]",2025-02-27T19:42:51Z,https://time.com/7262476/trump-tariffs-ai/
Cybercriminals ditch Bitcoin for stablecoins as illicit trades potentially surpassed $51 billion in 2024 – Chainalysis,"Illicit crypto transactions exceeded $51 billion in 2024, significantly higher than previous estimates due to underreporting, according to blockchain analytics firm Chainalysis. The findings, published in the company’s latest Crypto Crime Report, indicate a s…","Illicit crypto transactions exceeded $51 billion in 2024, significantly higher than previous estimates due to underreporting, according to blockchain analytics firm Chainalysis.
The findings, publis… [+4323 chars]",2025-02-27T19:15:55Z,https://cryptoslate.com/cybercriminals-ditch-bitcoin-for-stablecoins-as-illicit-trades-potentially-surpassed-51-billion-in-2024-chainalysis/
ImageX: Counting Down to DrupalCon Atlanta 2025: Our Top Session Picks for You,Authored by,"Authored by Nadiia Nykolaichuk.
All eyes in the Drupal universe are on Atlanta! The countdown is on for DrupalCon Atlanta 2025an event packed with insights, innovation, and community spirit. While m… [+10561 chars]",2025-02-27T19:05:40Z,https://imagexmedia.com/blog/drupalcon-atlanta-2025-top-session-picks
2:00PM Water Cooler 2/27/2025,"~ Today's Water Cooler: Politics, Syndemics; <li>Executive Order details DOGE's Bolshevik-style structure and operation; DOGE as class war; Cuomo floats Presidential trial balloon; Employment figures warn of a souring economy ~</li>","By Lambert Strether.
Readers, the fundraiser for my very nearly gold retirement watch + all my Water Cooler work done in 2024 is ongoing. The goal is 400 donors; as of this writing, we have 275, or … [+34444 chars]",2025-02-27T19:00:34Z,https://www.nakedcapitalism.com/2025/02/200pm-water-cooler-2-27-2025.html
FBI: North Korea-linked TraderTraitor is responsible for $1.5 Billion Bybit hack,"The FBI confirmed that North Korea is responsible for the record-breaking cyber heist at the crypto exchange Bybit. FBI links the recent Bybit hack to North Korea-linked group TraderTraitor as details of the $1.5B cyber heist emerge. Last week, the crypto exc…","FBI: North Korea-linked TraderTraitor is responsible for $1.5 Billion Bybit hack
 | Criminal group UAC-0173 targets the Notary Office of Ukraine
 | Cellebrite blocked Serbia from using its solution… [+143066 chars]",2025-02-27T18:57:11Z,https://securityaffairs.com/174735/cyber-crime/fbi-north-korea-responsible-bybit-hack.html
"Panel to suggest ways to strengthen supply chains, cut dependence on China for pharma products",The Department of Pharmaceuticals (DoP) has formed a technical committee to create a strategy and roadmap to strengthen supply chains and reduce dependence on China for pharmaceutical products. This aligns with the Indo-Pacific Economic Framework for Prosperi…,"Artificial Intelligence(AI)
AI and Analytics based Business Strategy
By - Tanusree De, Managing Director- Accenture Technology Lead, Trustworthy AI Center of Excellence: ATCI
View Program",2025-02-27T18:53:33Z,https://economictimes.indiatimes.com/industry/healthcare/biotech/pharmaceuticals/panel-to-suggest-ways-to-strengthen-supply-chains-cut-dependence-on-china-for-pharma-products/articleshow/118611013.cms
"Trump tariffs on Mexico and Canada to take effect March 4, with China levies doubling—What will this mean for Americans, businesses, and the global economy?","Trump’s tariffs on Canada, Mexico, and China are set to take effect on March 4, shaking global trade and financial markets. The U.S. will impose a 25% tariff on Mexican and Canadian imports and a 10% levy on Canadian energy products, citing drug trafficking c…","Artificial Intelligence(AI)
AI and Analytics based Business Strategy
By - Tanusree De, Managing Director- Accenture Technology Lead, Trustworthy AI Center of Excellence: ATCI
View Program",2025-02-27T18:24:26Z,https://economictimes.indiatimes.com/news/international/us/trump-tariffs-mexico-canada-march-4-china-levies-impact-economy/articleshow/118609672.cms
"NVIDIA Confirms: ""Blackwell Ultra"" Coming This Year, ""Vera Rubin"" in 2026","During its latest FY2024 earnings call, NVIDIA's CEO Jensen Huang gave a few predictions about future products. The upcoming Blackwell B300 series, codenamed ""Blackwell Ultra,"" is scheduled for release in the second half of 2025. It will feature significant p…","During its latest FY2024 earnings call, NVIDIA's CEO Jensen Huang gave a few predictions about future products. The upcoming Blackwell B300 series, codenamed ""Blackwell Ultra,"" is scheduled for relea… [+1707 chars]",2025-02-27T17:43:11Z,https://www.techpowerup.com/333253/nvidia-confirms-blackwell-ultra-coming-this-year-vera-rubin-in-2026
Evaluate healthcare generative AI applications using LLM-as-a-judge on AWS,"In this post, we demonstrate how to implement this evaluation framework using Amazon Bedrock, compare the performance of different generator models, including Anthropic’s Claude and Amazon Nova on Amazon Bedrock, and showcase how to use the new RAG evaluation…","In our previous blog posts, we explored various techniques such as fine-tuning large language models (LLMs), prompt engineering, and Retrieval Augmented Generation (RAG) using Amazon Bedrock to gener… [+23366 chars]",2025-02-27T17:40:33Z,https://aws.amazon.com/blogs/machine-learning/evaluate-healthcare-generative-ai-applications-using-llm-as-a-judge-on-aws/
"Veracode Reveals Half of Organizations Burdened by Critical Security Debt, with 70% Stemming from Third-party Code and the Software Supply Chain",Veracode launched its 15th edition of the State of Software Security (SoSS) report.,"Veracode launched its 15th
 edition of the State of Software Security (SoSS) report. The report, 
based on an extensive dataset of 1.3 million unique applications and 
126.4 million raw findings, … [+5299 chars]",2025-02-27T17:30:00Z,https://vmblog.com:443/archive/2025/02/27/veracode-reveals-half-of-organizations-burdened-by-critical-security-debt-with-70-stemming-from-third-party-code-and-the-software-supply-chain.aspx
South Africa's AI & Fintech Boom: Key Insights from 2025 Tech Trends Report,"The Tech Trends in South Africa 2025 report highlights the rapid expansion of AI, blockchain, fintech, and digital banking in the region. With South Africa ranking among the top 20 global crypto markets, the adoption of digital payments, IoT, and cybersecurit…","Dublin, Feb. 27, 2025 (GLOBE NEWSWIRE) -- The ""Tech Trends in South Africa 2025"" report has been added to ResearchAndMarkets.com's offering.
The report focuses on technology developments that affect… [+5897 chars]",2025-02-27T17:21:00Z,https://www.globenewswire.com/news-release/2025/02/27/3034139/28124/en/South-Africa-s-AI-Fintech-Boom-Key-Insights-from-2025-Tech-Trends-Report.html
NVIDIA’s CEO Jensen Huang Confirms Blackwell Ultra & Vera Rubin AI Architectures To Be On-Track; Ready To Unleash Their Might On GTC 2025,"NVIDIA has confirmed that its upcoming Blackwell Ultra and Rubin AI architectures are on track, saying that the next ""AI train"" will be broader than ever. NVIDIA's Next-Gen AI Product Lineups To Be Unveiled Alongside Each Other; Annual Product Cadence Seems U…","NVIDIA has confirmed that its upcoming Blackwell Ultra and Rubin AI architectures are on track, saying that the next ""AI train"" will be broader than ever.
Well, Team Green's next-gen AI lineups are … [+2840 chars]",2025-02-27T17:09:52Z,https://wccftech.com/nvidia-ceo-jensen-huang-confirms-blackwell-ultra-ready-to-on-track/
Olas' Mech Marketplace Enables AI Agents to Hire Each Other for Help,Crypto and AI firm Olas is making it easier for AI agents to collaborate.,"What if artificial intelligence (AI) agents could hire other AI agents to help them with their work?
Thats essentially the idea behind Mech Marketplace, a decentralized platform from crypto-AI firm … [+2105 chars]",2025-02-27T17:00:00Z,https://www.coindesk.com/markets/2025/02/27/olas-mech-marketplace-enables-ai-agents-to-hire-each-other-for-help
What’s New in AI/BI - Feb ‘25 Roundup,"Introduction AI/BI Dashboards and Genie are evolving at a breakneck pace. In this roundup, we’ll highlight the most impactful updates from the past three months...","Introduction
AI/BI Dashboards and Genie are evolving at a breakneck pace. In this roundup, well highlight the most impactful updates from the past three months that make AI/BI more powerful, easier … [+10117 chars]",2025-02-27T17:00:00Z,https://www.databricks.com/blog/whats-new-in-aibi-feb25
Could OpenAI build the operating system like the one in ‘Her’?,"Welcome to AI Decoded, Fast Company’s weekly newsletter that breaks down the most important news in the world of AI. You can sign up to receive this newsletter every week here.



Will native-AI operating systems run our computers in the near future? 



Sama…","Welcome to AI Decoded, Fast Companys weekly newsletter that breaks down the most important news in the world of AI. You can sign up to receive this newsletter every week here.
Samantha, the AI that … [+7163 chars]",2025-02-27T17:00:00Z,https://www.fastcompany.com/91286155/could-openai-build-the-operating-system-like-the-one-in-her
WWE 2K25's Newest Feature Took 11 Years To Get Here. Is It Worth The Wait?,"Find out how WWE 2K25 brings back intergender matches after over a decade, offering new gameplay and customization options for matches.","For more than a decade, fans of wrestling games like WWE 2K25 have been asking for a feature that seems simple but has a big impact intergender matches. While the WWE 2K series has been around for 11… [+7072 chars]",2025-02-27T16:30:18Z,https://screenrant.com/wwe-2k25-intergender-wrestling-new-feature-op-ed/
"Is AI all hype? DeepSeek tumbles to #51 on Apple's App Store, weeks after dethroning ChatGPT as the most downloaded free AI app in the US — OpenAI CEO Sam Altman already promised to ""obviously deliver better models""","DeepSeek has tumbled to #51, weeks after dethroning OpenAI's ChatGPT as the most downloaded free AI app in Apple's App Store in the United States.","Following generative AI trends can be daunting at times, with multiple scientific breakthroughs announced frequently, sometimes simultaneously.
In the latest episode, DeepSeek has tumbled to #51, we… [+6007 chars]",2025-02-27T16:26:18Z,https://www.windowscentral.com/software-apps/deepseek-tumbles-to-51-on-apples-app-store-weeks-after-dethroning-chatgpt
A New Gulf Growth Model,"Saudi Arabia, the United Arab Emirates, and other Gulf economies find themselves in an increasingly advantageous position, owing to changing geopolitical and market dynamics. The coming months and years may represent the best chance the region has ever had to…","Saudi Arabia, the United Arab Emirates, and other Gulf economies find themselves in an increasingly advantageous position, owing to changing geopolitical and market dynamics. The coming months and ye… [+6729 chars]",2025-02-27T16:23:17Z,https://www.project-syndicate.org/commentary/new-gulf-growth-model-diversification-away-from-oil-by-faris-al-sulayman-and-steffen-hertog-2025-02
Winos 4.0 Malware Targets Taiwan With Email Impersonation,"Winos 4.0 malware uses phishing emails to target organizations in Taiwan, Fortinet experts warn","A new malware campaign using Winos 4.0 that targets organizations in Taiwan through email impersonation has been uncovered by cybersecurity experts. 
FortiGuard Labs observed the attack in January 2… [+3056 chars]",2025-02-27T16:00:00Z,https://www.infosecurity-magazine.com/news/winos-40-malware-targets-taiwan/
Nvidia shows Big Tech's AI spending spree is still going strong,"Nvidia (NVDA) delivered another record quarter and raised outlook on strong demand for its Blackwell artificial intelligence chips, confirming that Big Tech’s big spending on AI will continue, analysts said.Read more...","In This Story
Nvidia (NVDA-3.54%
) delivered another record quarter and raised outlook on strong demand for its Blackwell artificial intelligence chips, confirming that Big Techs big spending on AI… [+2378 chars]",2025-02-27T15:59:10Z,https://qz.com/big-tech-ai-spending-nvidia-earnings-data-center-chips-1851766726
How Ikea approaches AI governance,A responsible AI policy and multidisciplinary team built the foundation of the company's compliance with the EU AI Act.,Technology leaders have been pushed to create comprehensive AI governance playbooks before adoption can begin. But Ikea Retail Chief Data and Analytics Officer Francesco Marzoni has taken a different… [+4640 chars],2025-02-27T15:57:00Z,https://www.ciodive.com/news/Ikea-AI-governance-approach-EU-Act-Pact-compliance/740696/
