title,description,content,publishedAt,url
Congress: Offshore Production Critical to Energy Security,"In one of the House Committee on Natural Resources’ first oversight hearings, a subcommittee held a hearing focused on restoring American energy dominance through offshore oil and natural gas development – highlighting the continued shift in tone in the new C…","In one of the House Committee on Natural Resources first oversight hearings, a subcommittee held a hearing focused on restoring American energy dominance through offshore oil and natural gas developm… [+4880 chars]",2025-02-27T15:53:30Z,https://energycentral.com/c/og/congress-offshore-production-critical-energy-security
Criminal group UAC-0173 targets the Notary Office of Ukraine,CERT-UA warns of UAC-0173 using DCRat malware to target Ukrainian notaries in a new attack wave since mid-January 2025. The Computer Emergency Response Team of Ukraine (CERT-UA) warned of a new campaign by criminal group UAC-0173 targeting Ukrainian notaries …,"Criminal group UAC-0173 targets the Notary Office of Ukraine
 | Cellebrite blocked Serbia from using its solution because misuse of the equipment for political reasons
 | New Ghostwriter campaign t… [+142981 chars]",2025-02-27T15:33:58Z,https://securityaffairs.com/174723/cyber-crime/uac-0173-targets-the-notary-office-of-ukraine.html
Ford Business Solutions expands in India with new Bengaluru office,"Ford Business Solutions expands to Bengaluru, aiming to recruit 2,000 employees by 2025 for high-tech, niche skills.","Ford Business Solutions, the global hub of technology and business services within the Ford family, has launched an office in Bengaluru. With a Global Capability Center (GCC) in Chennai and around 12… [+1827 chars]",2025-02-27T15:32:45Z,https://www.thehindubusinessline.com/info-tech/ford-business-solutions-expands-in-india-with-new-bengaluru-office/article69271395.ece
Is The Bybit Crypto Hack The Future? DePIN Looks To Make Web3 Much Safer,"The Bybit crypto hack, the largest in history,  shines a spotlight again on central crypto exchange security. DePIN, the rising star of Web3, could have prevented the hack.","A price chart on the Bybit website for the cryptocurrency Ethereum is seen on a computer screen in ... [+] New York on Friday evening, Feb. 21, 2025. (AP Photo/Patrick Sison)
Associated Press
The B… [+10249 chars]",2025-02-27T15:17:11Z,https://www.forbes.com/sites/lawrencewintermeyer/2025/02/27/is-the-bybit-crypto-hack-the-future-depin-looks-to-make-web3-much-safer/
Titan America Selects BCMI Dispatch for Concrete Operations,Titan America will install cloud-based concrete dispatch from BCMI Corp. at all its U.S. operations. ......,"REDMOND, Wash., Feb. 27, 2025 (GLOBE NEWSWIRE) -- Titan America, based in Norfolk, Virginia, has announced it will install cloud-based concrete dispatch from BCMI Corp., a software developer for the … [+2657 chars]",2025-02-27T15:10:00Z,https://www.globenewswire.com/news-release/2025/02/27/3034002/0/en/Titan-America-Selects-BCMI-Dispatch-for-Concrete-Operations.html
Meta Reportedly Considers Breaking Off Reels From Instagram,"Instagram reportedly thinks sticking Reels in a separate app will remedy the sting of losing TikTok, but it may just leave us with two dying apps instead of one.","In many ways, Reels is Instagram now. You cant scroll on the photo-sharing app for a few seconds before being slapped across the face with algorithmic suggested for you video content. Meta, in all it… [+3275 chars]",2025-02-27T15:00:23Z,https://gizmodo.com/meta-reportedly-considers-breaking-off-reels-from-instagram-2000569228
The Power of AI: Transforming E-Commerce for a Smarter Future,"Is your e-commerce business struggling to stand out in a saturated market? With thousands of competitors just a click away, delivering a seamless, personalized experience can feel like an uphill battle.  Customers demand tailored recommendations, instant supp…","Is your e-commerce business struggling to stand out in a saturated market? With thousands of competitors just a click away, delivering a seamless, personalized experience can feel like an uphill batt… [+7036 chars]",2025-02-27T14:30:00Z,https://androidguys.com/promoted-news/the-power-of-ai-transforming-e-commerce-for-a-smarter-future/
FMCG players bet on AI across the value chain,"FMCG players use AI for personalized products, digital advertising, consumer trends, and distribution network optimization.","Fast-Moving Consumer Goods (FMCG) players are using artificial intelligence across the value chain to offer consumers personalised tailor-made products. 
FMCG makers are also leveraging AI in digita… [+2212 chars]",2025-02-27T14:20:51Z,https://www.thehindubusinessline.com/companies/fmcg-players-bet-on-ai-across-the-value-chain/article69270847.ece
Debunked: Image of Pope Francis with respirator mask was made with generative AI,"At first glance, the image may appear convincing, but there are details that give it away as computer-generated.","AN IMAGE APPEARING to show Pope Francis in bed wearing a respirator mask is not a real photograph, it was made using generative artificial intelligence. 
The Pope was admitted to Romes Gemelli Hospi… [+3511 chars]",2025-02-27T14:09:37Z,https://www.thejournal.ie/debunked-image-of-pope-francis-with-respirator-mask-is-made-with-generative-ai-6634589-Feb2025/
Meta apologizes after Instagram users are flooded with violent videos,"The troubling content featured graphic depictions of individuals being shot, run over by vehicles and suffering gruesome injuries.","Meta issued an apology Wednesday night after an error caused Instagrams recommendation algorithm to flood users Reels feeds with disturbing and violent videos, some depicting fatal shootings and horr… [+4795 chars]",2025-02-27T14:04:39Z,https://nypost.com/2025/02/27/business/meta-apologizes-after-instagram-users-were-flooded-with-violent-videos/
Bittensor App Gets Hack Risk Cover From Nexus Mutual-Backed Insurance Firm Native,"Team Rizzo, which operates Bittensor subnets and validator services, has snagged $25 million in on-chain cover from Native, a digital asset insurance specialist.","Digital-asset insurance broker Native said it arranged $25 million of blockchain-based cover against hacks for Team Rizzo, an operator of machine-learning businesses and staking validator services on… [+2191 chars]",2025-02-27T14:00:00Z,https://www.coindesk.com/business/2025/02/27/bittensor-gets-hack-risk-cover-from-nexus-mutual-backed-insurance-firm-native
Immunoinformatic evaluation for the development of a potent multi-epitope vaccine against bacterial vaginosis caused by Gardnerella vaginalis,"Background Bacterial vaginosis (BV) is the most common vaginal dysbiosis in fertile women, which is associated with side effects including the risk of premature birth. Gardnerella vaginalis (G. vaginalis) is a facultative anaerobic bacillus known as the main …","Citation: Motamedi H, Shoja S, Abbasi M (2025) Immunoinformatic evaluation for the development of a potent multi-epitope vaccine against bacterial vaginosis caused by Gardnerella vaginalis. PLoS ONE … [+37153 chars]",2025-02-27T14:00:00Z,https://journals.plos.org/plosone/article?id=10.1371/journal.pone.0316699
SHIBI & SOL: Could This Be the Ultimate Meme Coin Pairing? Panda Frenzy Taking Over the Market!,"Meme coins aren’t just having a moment – they’re rewriting the rules. And right now, two names are stirring up the most buzz: Solana crypto, the blockchain beast with a proven track record and Panshibi (SHIBI), the underdog turned overnight sensation. While S…","Disclaimer: The below article is sponsored, and the views in it do not represent those of ZyCrypto. Readers should conduct independent research before taking any actions related to the project mentio… [+4568 chars]",2025-02-27T13:43:09Z,https://zycrypto.com/shibi-sol-could-this-be-the-ultimate-meme-coin-pairing-panda-frenzy-taking-over-the-market/
Intel Corporation (INTC) : Among Stocks That Could Skyrocket After Jensen Huang’s Earnings Call,"We recently published a list of 10 Stocks That Could Skyrocket After Jensen Huang’s Earnings Call. In this article, we are going to take a look at where...","We recently published a list of 10 Stocks That Could Skyrocket After Jensen Huangs Earnings Call. In this article, we are going to take a look at where Intel Corporation (NASDAQ:INTC)  stands against… [+3431 chars]",2025-02-27T13:34:08Z,https://finance.yahoo.com/news/intel-corporation-intc-among-stocks-133408152.html
