title,description,content,publishedAt,url
Canada Loyalty Programs Business Intelligence Report 2025: Market to Grow by 14.6% to Reach $1.78 Billion this Year – Future Growth Dynamics to 2029 – ResearchAndMarkets.com,"DUBLIN — The “Canada Loyalty Programs Market Intelligence and Future Growth Dynamics – 50+ KPIs on Loyalty Programs Trends by End-Use Sectors, Operational KPIs, Retail Product Dynamics, and Consumer Demographics – Q1 2025 Update” report has been added to Rese…","Author of the article:
Article content
DUBLIN The Canada Loyalty Programs Market Intelligence and Future Growth Dynamics 50+ KPIs on Loyalty Programs Trends by End-Use Sectors, Operational KPIs, Re… [+12624 chars]",2025-02-28T16:17:08Z,https://financialpost.com/pmn/business-wire-news-releases-pmn/canada-loyalty-programs-business-intelligence-report-2025-market-to-grow-by-14-6-to-reach-1-78-billion-this-year-future-growth-dynamics-to-2029-researchandmarkets-com
IBM Granite 3.2 adds Enhanced Reasoning to its AI mix,"IBM ups its AI game by adding experimental chain-of-thought reasoning capabilities to its latest large language model, Granite 3.2.","IBM/ZDNET
In its latest addition to its Granite family of large language models (LLMs), IBM has unveiled Granite 3.2. This new release focuses on delivering small, efficient, practical artificial in… [+4305 chars]",2025-02-28T16:14:47Z,https://www.zdnet.com/article/ibm-granite-3-2-adds-enhanced-reasoning-to-its-ai-mix/
RI backs ASEAN economic priorities under Malaysia,Deputy Trade Minister Dyah Roro Esti has expressed Indonesia&#39;s support for the priority economic deliverables put forward by Malaysia as ASEAN chair this ...,"Jakarta (ANTARA) - Deputy Trade Minister Dyah Roro Esti has expressed Indonesia's support for the priority economic deliverables put forward by Malaysia as ASEAN chair this year.According to Esti, th… [+3255 chars]",2025-02-28T15:53:24Z,https://en.antaranews.com/news/346709/ri-backs-asean-economic-priorities-under-malaysia
"Bite at innovation to global supply-chain, domestic drugmakers plan for the future","US tariffs do not make sense, as less expensive generic drugs are needed to control healthcare costs","A global collaboration towards a secure supply-chain or a differentiated manufacturing model are just some of the options suggested by domestic drugmakers, as they face global challenges including in… [+2513 chars]",2025-02-28T15:50:40Z,https://www.thehindubusinessline.com/news/national/bite-at-innovation-to-global-supply-chain-domestic-drugmakers-plan-for-the-future/article69275963.ece
Hybrid AI and Human Red Teams: Critical to Preventing Policies from Exploitation by Adversaries,"Why such hybrid AI and human red teams are needed should now be clear.
The post Hybrid AI and Human Red Teams: Critical to Preventing Policies from Exploitation by Adversaries appeared first on The National Interest.",The Red Cell series is published in collaboration with the Stimson Center. Drawing upon the legacy of the CIAs Red Cellestablished following the September 11 attacks to avoid similar analytic failure… [+13340 chars],2025-02-28T15:29:48Z,https://nationalinterest.org/blog/techland/hybrid-ai-and-human-red-teams-critical-to-preventing-policies-from-exploitation-by-adversaries/
Factory begins trial for humanoid robots that can build more of themselves,"Robot-maker Apptronik has announced a pilot partnership with American firm Jabil. In addition to its supply chain services primarily serving OEMs, Jabil is involved in designing, engineering, and manufacturing electronic circuit boards and systems.Read Entire…","A hot potato: The prospect of humanoid robots building more humanoid robots sounds like something from science fiction, but an Austin-based company has just signed a deal that could eventually lead t… [+2666 chars]",2025-02-28T15:24:00Z,https://www.techspot.com/news/106967-factory-trials-begin-humanoid-robots-could-build-more.html
Enhanced capabilities sustain the rapid growth of Vo1d botnet,"Operators behind the Vo1d botnet have enhanced its capabilities, enabling rapid growth in recent months. In September 2024, Doctor Web researchers uncovered a malware, tracked as Vo1d, that infected nearly 1.3 million Android-based TV boxes belonging to users…","Enhanced capabilities sustain the rapid growth of Vo1d botnet
 | Cisco fixed command injection and DoS flaws in Nexus switches
 | China-linked threat actors stole 10% of Belgian State Security Serv… [+143295 chars]",2025-02-28T15:20:35Z,https://securityaffairs.com/174762/malware/enhanced-capabilities-sustain-the-rapid-growth-of-vo1d-botnet.html
Wall Street eases toward the end of its dreary February,"A rebound for Nvidia following its sharp drop the day before helped steady the market, and the majority of stocks rose.","By STAN CHOE, Associated Press Business Writer
NEW YORK (AP) — Wall Street is easing toward the end of its dreary February, and U.S. stock indexes are drifting following an economic report that incl… [+4724 chars]",2025-02-28T14:55:34Z,https://www.bostonherald.com/2025/02/28/financial-markets-discouraging-trends/
Elon enters the circus,"The shadow president paced around the stage after his speech, sunglasses on, mouth frozen in a grin, raising a chainsaw overhead to the delight of an adoring crowd as a large rectangular canvas made its way from the back of the audience toward him. He grabbed…","The GOP big tent gets even bigger, but not everyone at CPAC loves the tech oligarchs hold over Trump.
The shadow president paced around the stage after his speech, sunglasses on, mouth frozen in a g… [+31382 chars]",2025-02-28T14:41:51Z,https://www.theverge.com/policy/620892/cpac-elon-musk-chainsaw-trump-steve-bannon
"Funding woes threaten farm water tech startups, say experts",Funding for startups has been a key focus area for the government.,"New Delhi: About a fourth of the 70-100 active startups focused on agricultural water management and treatment are at risk of shutting down due to a lack of funding, according to experts.
The potent… [+4197 chars]",2025-02-28T14:30:19Z,https://www.livemint.com/industry/funding-agwatertech-startups-india-farm-water-technology-agritech-agriculture-water-management-11740742327248.html
OrganOx secures $142M equity financing for organ technology platform,The company will use the funds to hasten the growth of its metra normothermic machine perfusion platform.,"Commercial-stage organ technology company OrganOx announced it has completed a $142 million primary and secondary equity financing.
New investor HealthQuest Capital led the oversubscribed round with… [+2509 chars]",2025-02-28T14:28:06Z,https://www.mobihealthnews.com/news/organox-secures-142m-equity-financing-organ-technology-platform
Billions.Network launches universally accessible verification platform for humans and AI,"Billions.Network, intended to be a universal human and AI network, is launching to transform digital identity verification.","Billions.Network, intended to be a universal human and AI network, is launching to transform digital identity verification.
More than 9,000 projects across Web2 and Web3 are already using Billions z… [+5287 chars]",2025-02-28T14:00:00Z,https://venturebeat.com/business/billions-network-launches-universally-accessible-verification-platform-for-humans-and-ai/
India powers Apple supply; Zerodha’s trading slump,Apple’s India manufacturers are shipping components for MacBooks and AirPods to China and Vietnam. This and more in today’s ETtech Top 5.,"Apples India manufacturers are shipping components for MacBooks and AirPods to China and Vietnam. This and more in todays ETtech Top 5.Also in the letter: OpenAIs big GPT-4.5 revealRuPays rise, NPCIs… [+6925 chars]",2025-02-28T13:39:51Z,https://m.economictimes.com/tech/newsletters/tech-top-5/india-powers-apple-supply-zerodhas-trading-slump/articleshow/118630681.cms
Best Altcoins 2025: AI Grok causes Coldware to trend pushing presale to $1.1M,"Artificial intelligence (AI) is playing a bigger role in crypto market predictions, and Grok AI, […]","Artificial intelligence (AI) is playing a bigger role in crypto market predictions, and Grok AI, an advanced analytics platform, has recently identified Coldware (COLD) as a leading altcoin for 2025.… [+3319 chars]",2025-02-28T13:05:49Z,https://ambcrypto.com/best-altcoins-2025-ai-grok-causes-coldware-to-trend-pushing-presale-to-1-1m/
"Asean needs high-level task force, says Zafrul","DESARU: Asean needs to have a high-level task force to look at various scenarios with regards to the latest economic environment facing the world, says Tengku Zafrul Abdul Aziz. Read full story","DESARU: Asean needs to have a high-level task force to look at various scenarios with regards to the latest economic environment facing the world, says Tengku Zafrul Abdul Aziz.
The Investment, Trad… [+6318 chars]",2025-02-28T12:54:00Z,https://www.thestar.com.my/news/nation/2025/02/28/asean-needs-high-level-task-force-says-zafrul
Cisco fixed command injection and DoS flaws in Nexus switches,"Cisco addressed command injection and denial-of-service (DoS) vulnerabilities in some models of its Nexus switches. Cisco released security updates to address command injection and DoS vulnerabilities in Nexus switches, including a high-severity flaw. The mos…","Cisco fixed command injection and DoS flaws in Nexus switches
 | China-linked threat actors stole 10% of Belgian State Security Service (VSSE)'s staff emails
 | FBI: North Korea-linked TraderTraito… [+143229 chars]",2025-02-28T11:59:31Z,https://securityaffairs.com/174753/security/cisco-fixed-command-injection-and-dos-flaws-in-nexus-switches.html
"APEC 2025: S Korea advances regional trade, AI, sustainability agenda","South Korea kicked off its APEC 2025 host year in the historic Gyeongju city with delegates from 21 economies, setting the stage for a year of policy ...","Jakarta (ANTARA) - 
South Korea kicked off its APEC 2025 host year in the historic Gyeongju city with delegates from 21 economies, setting the stage for a year of policy deliberations and cooperatio… [+3586 chars]",2025-02-28T11:48:55Z,https://en.antaranews.com/news/346661/apec-2025-s-korea-advances-regional-trade-ai-sustainability-agenda
"The Dino, the Llama, and the Whale (Deno and Jupyter for Local AI Experiments)",Did you know you can run a large language model with Deno and Jupyter Notebooks? Here's how.,"I have had a desire for a while to understand what it would take to be able to
interact with a locally hosted large language model and with the release of
DeepSeek R1, a reasoning model, was enough… [+6116 chars]",2025-02-28T11:43:22Z,https://deno.com/blog/the-dino-llama-and-whale
HP says it will move large parts of production out of China,"After acquiring more stock last quarter, HP is planning to remove almost all of its US manufacturing away from China.","<ul><li>HP confirms plans to remove around 90% of its US manufacturing from China</li><li>The company acquired more stock in recent months, allowing the move</li><li>Total company revenue is up 2.4%<… [+2420 chars]",2025-02-28T11:02:00Z,https://www.techradar.com/pro/hp-says-it-will-move-large-parts-of-production-out-of-china
The Promise Of Nuclear Energy,A mix of sources will be the key to unlocking our energy-secure future.,"Samuel Gibson is the founder and CEO of Hadron Energy developing micro nuclear reactors for data centers.
getty
Nuclear energy has been receiving a lot of positive attention given the immense benef… [+6762 chars]",2025-02-28T11:00:00Z,https://www.forbes.com/councils/forbestechcouncil/2025/02/28/the-promise-of-nuclear-energy/
DeepSeek 400 error Invalid format [Fix],"[ comments ]This article shows how to fix the DeepSeek 400 error, Invalid Format. The cause of this error is an invalid request body format, which means that the request sent by the client does not follow the required format defined by the DeepSeek API. If yo…","This article shows how to fix the DeepSeek 400 error, Invalid Format. The cause of this error is an invalid request body format, which means that the request sent by the client does not follow the re… [+4961 chars]",2025-02-28T10:50:00Z,https://www.thewindowsclub.com/deepseek-400-error-invalid-format-fix
"12,000+ API Keys and Passwords Found in Public Datasets Used for LLM Training","A dataset used to train large language models (LLMs) has been found to contain nearly 12,000 live secrets, which allow for successful authentication.
The findings once again highlight how hard-coded credentials pose a severe security risk to users and organiz…","A dataset used to train large language models (LLMs) has been found to contain nearly 12,000 live secrets, which allow for successful authentication.
The findings once again highlight how hard-coded… [+4987 chars]",2025-02-28T10:24:00Z,https://thehackernews.com/2025/02/12000-api-keys-and-passwords-found-in.html
"""2 Decades Of Partnership Natural, Organic"": PM Modi On India-EU Ties","Prime Minister Narendra Modi has lauded the partnership between India and the European Union, terming the strategic partnership between them as &quot;organic and natural.&quot;","New Delhi: Prime Minister Narendra Modi has lauded the partnership between India and the European Union, terming the strategic partnership between them as ""organic and natural."" Further he said that … [+3328 chars]",2025-02-28T10:19:47Z,https://www.ndtv.com/india-news/2-decades-of-partnership-natural-organic-pm-modi-on-india-eu-ties-7815430
Canada’s critical minerals and why Trump wants them,,"Ukraine president Volodymyr Zelenskyy is expected to sign a critical minerals deal at the White House on Friday, after weeks of pressure from President Donald Trump seeking repayment for U.S. aid in … [+11169 chars]",2025-02-28T10:09:06Z,https://www.nationalobserver.com/2025/02/28/explainer/canada-critical-minerals-trump
Beyond software: How ERP is a strategic growth enabler of India’s aerospace and defence sector,"ERP has become a crucial enabler for India’s aerospace and defence sector, streamlining operations, ensuring regulatory compliance, and optimising supply chain management. In a recent webinar, industry experts highlighted how ERP solutions are helping manufac…","Enterprise resource planning (ERP) has evolved into a crucial enabler for Indias aerospace and defence sector. As industries become more complex, ERP systems have emerged as the secret sauce that emp… [+9769 chars]",2025-02-28T09:39:48Z,https://economictimes.indiatimes.com/industry/transportation/airlines-/-aviation/beyond-software-how-erp-is-a-strategic-growth-enabler-of-indias-aerospace-and-defence-sector/articleshow/118625487.cms
The Opacity of Hope,"The United States underwent a profound political transformation after the terrorist attacks of September 11, 2001, with fear becoming the primary force shaping national discourse. Barack Obama’s presidency was seen as a chance to reverse this trend, but his v…","The United States underwent a profound political transformation after the terrorist attacks of September 11, 2001, with fear becoming the primary force shaping national discourse. Barack Obamas presi… [+31239 chars]",2025-02-28T09:34:16Z,https://www.project-syndicate.org/onpoint/how-failure-of-obama-hope-paved-the-way-for-trump-by-jonathan-levy-2025-02
Guru's Weekly Buzz: Feb 28-Mar 6,"<p>Guru By Bangkok Post's pick of the most exciting products, activities, food and travel to indulge in.</p>","Guru By Bangkok Post's pick of the most exciting products, activities, food and travel to indulge in.JOIN
Dynamic evening / The Slate Phuket / March 8
The Slate Phuket will host “Dynamic Dimensions… [+12331 chars]",2025-02-28T09:11:00Z,https://www.bangkokpost.com/life/social-and-lifestyle/2970283/gurus-weekly-buzz-feb-28-mar-6
"Stock market today: Asian shares skid, hit by Trump tariff hikes and doubts about AI","Asian shares are sharply lower, with benchmarks in Japan, Hong Kong and South Korea tumbling more than 2% after a broad retreat on Wall Street","BANGKOK -- Shares retreated Friday in Asia, with benchmarks in Japan, Hong Kong and South Korea tumbling more than 2% as U.S. President Donald Trumps decision to push ahead with 25% tariffs on import… [+3662 chars]",2025-02-28T08:30:14Z,https://abcnews.go.com/Business/wireStory/stock-market-today-asian-shares-skid-hit-trump-119279567
What Will Define the Future of Publishing?,"How can the publishing industry overcome the myriad challenges it faces? Writer Avya Chaudhary takes a look...
AI, big tech and social media are battering publishers from all sides. With walled gardens, the open web, and programmatic solutions gaining ground,…","How can the publishing industry overcome the myriad challenges it faces? Writer Avya Chaudhary takes a look...
AI, big tech and social media are battering publishers from all sides. With walled gard… [+7665 chars]",2025-02-28T08:00:00Z,https://www.exchangewire.com/blog/2025/02/28/what-will-define-the-future-of-publishing/
China-linked threat actors stole 10% of Belgian State Security Service (VSSE)’s staff emails,"Belgian authorities are investigating Chinese hackers for breaching its State Security Service (VSSE), stealing 10% of emails from 2021 to May 2023. The Belgian federal prosecutor’s office is probing a possible security breach on its State Security Service (V…","China-linked threat actors stole 10% of Belgian State Security Service (VSSE)'s staff emails
 | FBI: North Korea-linked TraderTraitor is responsible for $1.5 Billion Bybit hack
 | Criminal group UA… [+143163 chars]",2025-02-28T07:54:40Z,https://securityaffairs.com/174743/intelligence/china-linked-threat-actors-stole-10-of-belgian-state-security-service-vsse-emails.html
OpenAI says it's 'out of GPUs' as supply struggles continue across AI and gaming,"In a recent X post, OpenAI CEO Sam Altman addressed the company's GPU shortages, highlighting the challenges behind the GPT-4.5 rollout delay. Continue reading at TweakTown >","TL;DR: OpenAI is delaying GPT-4.5s rollout due to a GPU shortage, requiring tens of thousands more chips. Initially available to ChatGPT Pro, it will expand to Plus users as supply improves. OpenAI i… [+1665 chars]",2025-02-28T06:46:03Z,https://www.tweaktown.com/news/103597/openai-says-its-out-of-gpus-as-supply-struggles-continue-across-ai-and-gaming/index.html
Cybercrime is national security risk – Google Cloud execs detail prevention strategies,"Finextra spoke to leaders at Google Cloud: Nick Godfrey, senior director and global head, office of the CISO, and Jamie Collier, lead threat intelligence advisor (Europe), on how cybersecurity has evolved an what new threats are emerging in the financial crim…","Finextra spoke to leaders at Google Cloud: Nick Godfrey, senior director and global head, office of the CISO, and Jamie Collier, lead threat intelligence advisor (Europe), on how cybersecurity has ev… [+4650 chars]",2025-02-28T06:00:00Z,https://www.finextra.com/newsarticle/45565/cybercrime-is-national-security-risk--google-cloud-execs-detail-prevention-strategies
"Nvidia surpasses expectations with record Blackwell chip sales, yet stock remains suspiciously stagnant","Nvidia, the semiconductor giant at the forefront of the artificial intelligence (AI) revolution, has once again delivered a blockbuster earnings report, surpassing Wall Street expectations with record-breaking sales of its Blackwell chips. Despite the impress…","Nvidia, the semiconductor giant at the forefront of the artificial intelligence (AI) revolution, has once again delivered a blockbuster earnings report, surpassing Wall Street expectations with recor… [+4364 chars]",2025-02-28T06:00:00Z,https://www.naturalnews.com/2025-02-28-nvidia-surpasses-expectations-record-blackwell-chip-sales.html
ChatGPT releases new GPT-4.5: What’s new in the more advanced 'emotional' version?,"OpenAI has unveiled GPT-4.5, the latest and most advanced iteration of its AI model, designed to refine human-AI interactions with improved emotional intelligence, accuracy, and contextual understanding. Unlike its predecessors, GPT-4.5 prioritises intuitive …","The artificial intelligence race has entered a new phase with OpenAIs latest releaseGPT-4.5. Officially launched as a research preview for ChatGPT Pro users, the model will be accessible to Plus and … [+4743 chars]",2025-02-28T05:35:40Z,https://economictimes.indiatimes.com/news/new-updates/chatgpt-releases-new-gpt-4-5-whats-new-in-the-more-advanced-emotional-version/articleshow/118618245.cms
"NVIDIA CEO confirms Blackwell Ultra, Vera Rubin AI GPUs are on-track, reveal set for GTC 2025","NVIDIA CEO Jensen Huang confirms Blackwell Ultra and Vera Rubin AI GPUs are on the way, Rubin R100 will launch with next-gen HBM4 memory in 2025. Continue reading at TweakTown >","TL;DR: NVIDIA confirms its Blackwell Ultra and Vera Rubin AI architectures are on track, with major announcements expected at GTC 2025. Despite initial delays, production has ramped up, maintaining t… [+1836 chars]",2025-02-28T02:08:03Z,https://www.tweaktown.com/news/103584/nvidia-ceo-confirms-blackwell-ultra-vera-rubin-ai-gpus-are-on-track-reveal-set-for-gtc-2025/index.html
Stocks that will see action today: 28 February 2025,"Buzzing stocks, stocks to watch: Tata Power, TVS Motor, Transrail, Granules India, RVNL, Coffee Day, Coal India, GE Power, HCL Tech, Zomato","TP Solar Limited (TP Solar), a wholly-owned subsidiary of Tata Power Renewable Energy Ltd (TPREL) and a subsidiary of Tata Power, running Indias largest single location solar manufacturing plant, has… [+4103 chars]",2025-02-28T01:44:51Z,https://www.thehindubusinessline.com/markets/stocks-that-will-see-action-today-28-february-2025/article69271753.ece
OpenAI’s GPT-4.5 ‘won’t crush benchmarks’ but might be a better friend,"OpenAI has released a preview version of GPT-4.5, which it claims has a higher EQ and is more creative than previous versions. However, some observers claim the new model is overpriced.","ChatGPT-maker OpenAIs upcoming model could be as much as 20 times more costly than its predecessor but will be far more creative and natural in its conversational style, according to OpenAI and early… [+3215 chars]",2025-02-28T01:27:35Z,https://cointelegraph.com/news/openai-gpt4-5-wont-blow-your-mind-but-could-be-friend
Fire-Flyer File System from DeepSeek,A high-performance distributed file system designed to address the challenges of AI training and inference workloads.  - GitHub - deepseek-ai/3FS: A high-performance distributed file system design...,The Fire-Flyer File System (3FS) is a high-performance distributed file system designed to address the challenges of AI training and inference workloads. It leverages modern SSDs and RDMA networks to… [+4339 chars],2025-02-28T01:26:26Z,https://github.com/deepseek-ai/3FS
Share Market Live Updates 28 February 2025: Stock to buy today: Shriram Finance (₹607),"Sensex, Nifty, Share Prices LIVE: Shriram Finance stock has been appreciating since mid-January. Last week, it broke out of trendline resistance at ₹575. On Thursday, it surpassed another barrier at ₹590. Consequently, the stock has formed a higher high and i…","GE Power: Company gets additional contract worth Rs 273.5 crore from GREENKO KA01 IREP. (Positive)
Kernex Microsystems: Kernex-MRT
consortium bags project worth Rs 325.33 crore from South Eastern R… [+4752 chars]",2025-02-28T01:18:37Z,https://www.thehindubusinessline.com/markets/share-market-today-nifty-sensex-live-updates-28-february-2025/article69270118.ece
"Stock Market Highlights 28 February 2025: Bloodbath on D-Street; Sensex plunges 1.9% to 73,198, Nifty settles below 22,150","Sensex, Nifty updates on 28 February 2025: Benchmark indices Sensex and Nifty tumbled nearly 2% on Friday amid broad-based selling. The Sensex plunged 1414.33 points or 1.90 per cent to 73,198.10, while the Nifty fell 420.35 points or 1.86 per cent to 22,124.…","<li></li>
February 28, 2025 16:22Currency market today: Rupee depreciates 28 paise as US dollar strengthens amid trade tariff uncertainty
Rupee depreciates 28 paise as US dollar strengthens amid tr… [+48686 chars]",2025-02-28T01:18:37Z,https://www.thehindubusinessline.com/markets/share-market-highlights-28-february-2025/article69270118.ece
3 underrated Netflix movies you should watch this weekend (February 28-March 2),"Looking for underrated movies to watch this weekend? Netflix's selection of overlooked films includes animated flicks, cyberpunk stories, and found footage horror.","The Orchard
Table of Contents
Table of Contents
Suzume (2022)
Upgrade (2018)
Creep (2014)
Sometimes, the best movies aren’t the ones trending on your Netflix homepage — they’re the hidden gems … [+4813 chars]",2025-02-28T01:00:16Z,https://www.digitaltrends.com/movies/underrated-netflix-movies-to-watch-this-weekend-february-28-march-2-2025/
Infinera Corporation Fourth Quarter and Fiscal 2024 Financial Results,FY’24 Highlights:                              Year-over-year growth in bookings and backlog; book-to-bill ratio of approximately 1.1x for FY'24 and...,"FY24 Highlights:
<ul><li>Year-over-year growth in bookings and backlog; book-to-bill ratio of approximately 1.1x for FY'24 and 1.3x for Q4'24</li><li>Record revenue with webscalers - total revenue e… [+78754 chars]",2025-02-28T00:30:00Z,https://www.globenewswire.com/news-release/2025/02/28/3034441/0/en/Infinera-Corporation-Fourth-Quarter-and-Fiscal-2024-Financial-Results.html
