title,description,content,publishedAt,url
Skeptical Science New Research for Week #9 2025,"Open access notables
A twenty-first century structural change in Antarctica’s sea ice system, Raphael et al., Communications Earth & Environment:

From 1979 to 2016, total Antarctic sea ice extent experienced a positive trend with record winter maxima in 2012…","Posted on 27 February 2025 by Doug Bostrom, Marc Kodack
Open access notables
A twenty-first century structural change in Antarctica’s sea ice system, Raphael et al., Communications Earth &amp; Envi… [+47554 chars]",2025-02-27T07:55:54Z,https://skepticalscience.com/new_research_2025_9.html
"IoT in Smart Cities Market Size to Reach USD 952.69 Billion by 2032 Driven by AI, 5G, and sustainability initiatives | SNS Insider","The IoT in Smart Cities Market is expanding with demand for connected infrastructure, optimizing traffic, energy, and public safety. The IoT in Smart Cities Market is expanding with demand for connected infrastructure, optimizing traffic, energy, and public s…","Austin, Feb. 25, 2025 (GLOBE NEWSWIRE) -- IoT in Smart Cities Market Size &amp; Growth Insights:
According to the SNS Insider,The IoT in Smart Cities Market Size
 was valued at USD 195.18 Billion i… [+9880 chars]",2025-02-25T14:30:00Z,https://www.globenewswire.com/news-release/2025/02/25/3032148/0/en/IoT-in-Smart-Cities-Market-Size-to-Reach-USD-952-69-Billion-by-2032-Driven-by-AI-5G-and-sustainability-initiatives-SNS-Insider.html
How to make our cities more liveable,The people who flock the cities for work deserve certain minimum services. Grassroots leadership is crucial for an urban makeover,"For India to fulfill its aspiration to be a developed nation sans poverty, its urban areas need a dramatic makeover. While a lot of effort has been made, we also need to do a few things differently. … [+6482 chars]",2025-02-25T12:03:06Z,https://www.thehindubusinessline.com/opinion/making-our-cities-more-liveable/article69262072.ece
Did Chris Bishop just make the best speech about Auckland since Sir Dove-Myer ‘Robbie’ Robinson? - Simon Wilson,OPINION: Transport Minister Chris Bishop dreams of a denser Auckland built around transit.,"This is not an untested theory, said Bishop. Transit-oriented development has been adopted across the world in cities like Stockholm, Copenhagen, Hong Kong, Tokyo, and Singapore.
Ooh I just love it … [+7482 chars]",2025-02-24T16:00:00Z,https://www.nzherald.co.nz/nz/did-chris-bishop-just-make-the-best-speech-about-auckland-since-robbie-simon-wilson/OUBSAHG7HRFW5BU7PKEOSTF5IU/
Weekly Climate and Energy News Roundup #632,Quote of the Week: “Nobody’s honest. Scientists are not honest. And people usually believe that they are. That makes it worse. By honest I don’t mean that you only tell what’s true. But you make clear the entire situation. You make clear all the information t…,Quote of the Week:Nobodys honest. Scientists are not honest. And people usually believe that they are. That makes it worse. By honest I dont mean that you only tell whats true. But you make clear the… [+60509 chars],2025-02-24T10:00:00Z,https://wattsupwiththat.com/2025/02/24/weekly-climate-and-energy-news-roundup-632/
THE WALNUT STREET BRIDGE: SYMBOL OF CHATTANOOGA’S RESILIENCE AND RENEWAL,The Walnut Street Bridge stands as a remarkable testament to both Chattanooga's tumultuous history and its transformative future.,"CHATTANOOGA, Tenn. - March 4, 2021: Park visitors look out towards the Tennessee River near the ... [+] Walnut Street Bridge. The bridge is a popular destination for people in Chattanooga, but it has… [+10669 chars]",2025-02-18T17:43:23Z,https://www.forbes.com/sites/selikajosiahtalbott/2025/02/18/the-walnut-street-bridge-symbol-of-chattanoogas-resilience-and-renewal/
Reviewing Benjamin Moore Beach Glass (1564),"Have you ever noticed how the perfect paint color can transport you to your happy place? That’s exactly what Benjamin Moore Beach Glass does – it captures the serene beauty of sea glass tumbled smooth by ocean waves. In this guide, you’ll discover why Beach G…","Have you ever noticed how the perfect paint color can transport you to your happy place?
That’s exactly what Benjamin Moore Beach Glass does – it captures the serene beauty of sea glass tumbled smoo… [+12882 chars]",2025-02-18T06:43:04Z,https://ahouseinthehills.com/reviewing-benjamin-moore-beach-glass-1564/
Planning Communities for Thriving Children,"Planning Communities for Thriving Children

 



 
Todd Litman
Mon, 02/17/2025 - 10:00


 Virtually everybody, both conservative and liberal, claims that they want to help children be healthy and successful, but many policies introduced by the new federal adm…","Virtually everybody, both conservative and liberal, claims that they want to help children be healthy and successful, but many policies introduced by the new federal administration contradict those g… [+12076 chars]",2025-02-17T18:00:00Z,https://www.planetizen.com/blogs/134322-planning-communities-thriving-children
"The Future Of Transportation: AI, Connectivity And Safety In 2025","From autonomous vehicles and predictive maintenance connectivity and emerging mobility-as-a-service platforms, the industry is evolving at an unprecedented pace.","Dimitar Dimitrov is the founder and Managing Partner at Accedia, a leading European AI &amp; Custom Software Development Company.
getty
The transportation sector is set for major advancements in 20… [+6443 chars]",2025-02-10T12:00:00Z,https://www.forbes.com/councils/forbestechcouncil/2025/02/10/the-future-of-transportation-ai-connectivity-and-safety-in-2025/
Efforts on to make Rajapalayam in southwestern TN town carbon neutral by 2041,The Rajapalayam Local Planning Areas has potential to become a ‘Model and Showcase’ town and a trendsetter for other towns in India to emulate in being both ‘Climate Smart’ and ‘Carbon Neutral,"Talk of Rajapalayam, the first thing that comes to mind is the Rajapalayam Hound, also known as the Polygar Hound or Indian Ghost Hound, a famous Indian dog breed. However, in days to come Rajapalaya… [+4981 chars]",2025-02-04T11:40:08Z,https://www.thehindubusinessline.com/news/efforts-on-to-make-rajapalayam-in-southwestern-tn-town-carbon-neutral-by-2041/article69179578.ece
Efforts on to make Rajapalayam in southwestern TN town carbon neutral by 2041,The Rajapalayam Local Planning Areas has potential to become a ‘Model and Showcase’ town and a trendsetter for other towns in India to emulate in being both ‘Climate Smart’ and ‘Carbon Neutral,"Talk of Rajapalayam, the first thing that comes to mind is the Rajapalayam Hound, also known as the Polygar Hound or Indian Ghost Hound, a famous Indian dog breed. However, in days to come Rajapalaya… [+4981 chars]",2025-02-04T11:40:08Z,https://www.thehindubusinessline.com/news/national/efforts-on-to-make-rajapalayam-in-southwestern-tn-town-carbon-neutral-by-2041/article69179578.ece
Good Planning Under Bad Leadership,"Good Planning Under Bad Leadership

 



 
Todd Litman
Mon, 02/03/2025 - 08:00


 The term “conservative” literally means cautious and resource-efficient, such as less risky financial investments and reducing wasteful energy or water consumption. The new U.S.…","The term conservative literally means cautious and resource-efficient, such as less risky financial investments and reducing wasteful energy or water consumption. The new U.S. federal leadership is a… [+17938 chars]",2025-02-03T16:00:00Z,https://www.planetizen.com/blogs/134113-good-planning-under-bad-leadership
Canadian Transit “Think” Tank Presenting Fluff & Denials To Mississauga Council,"Over a couple of the last months of 2024, part of my time was spent looking at the bizarre situation of the Canadian Urban Transit Research and Innovation Consortium (CUTRIC). That’s resurfaced, as the Mississauga hydrogen bus trial is going forward despite h…","Sign up for daily news updates from CleanTechnica on email. Or follow us on Google News!
Over a couple of the last months of 2024, part of my time was spent looking at the bizarre situation of the C… [+34999 chars]",2025-02-03T15:55:18Z,https://cleantechnica.com/2025/02/03/canadian-transit-think-tank-presenting-fluff-denials-to-mississauga-council/
A Planet Full of Sorrows by M. L. Clark,"Everyone on the Ember dreams of Emanuel. Case says he’s always lippy with her in dreams, and that she’s had it up to here with his post-mortem attitude, but none […]","byM. L. ClarkEveryone on the Ember dreams of Emanuel.
Case says he’s always lippy with her in dreams, and that she’s had it up to here with his post-mortem attitude, but none of us is buying the com… [+74049 chars]",2025-02-01T17:08:13Z,https://clarkesworldmagazine.com/clark_02_25/
Budget 2025 full speech: Read FM Nirmala Sitharaman's Union Budget address here,"Budget 2025 Download full speech: The 2025-26 Budget introduces measures to accelerate growth, ensure inclusive development, and boost private sector investments. Key proposals include enhancing agricultural productivity, supporting MSMEs, and stimulating emp…","Honble Speaker, I present the Budget for 2025-26.Introduction This Budget continues our Governments efforts to:accelerate growth, secure inclusive development, invigorate private sector investments, … [+86313 chars]",2025-02-01T07:13:14Z,https://economictimes.indiatimes.com/news/economy/policy/budget-2025-full-speech-read-fm-nirmala-sitharamans-union-budget-address-here/articleshow/117821002.cms
Union Budget 2025 Highlights & Announcements: No income tax payable up to income of ₹12 lakh in New Tax regime,"Budget 2025 Key Highlights & Updates, Union Budget 2025 Outcomes, New Income Tax Slab Announcements: Here’s all the updates from the Union Budget presented in the Parliament by Finance Minister Nirmala Sitharaman. Find all updates in income tax rates and slab…","<li></li>
February 01, 2025 17:21Budget 2025 Live Updates: M V Rao, Chairman, Indian Banks Association (IBA) &amp; Managing Director &amp; CEO, Central Bank of India, on the Union Budget
Union Budg… [+220472 chars]",2025-02-01T01:18:25Z,https://www.thehindubusinessline.com/economy/budget/budget-2025-finance-minister-nirmala-sitharaman-india-union-budget-announcements-highlights/article69164458.ece
